{
  "$schema": "http://json-schema.org/draft-07/schema#",
  "$id": "harmonicon/theme",
  "title": "Harmonicon Theme",
  "description": "Visual theme for menus, gameplay screens, and UI elements.",
  "type": "object",
  "required": ["name", "description", "default_menu_button", "default_background", "menus"],
  "additionalProperties": false,

  "$defs": {
    "image_with_shader": {
      "type": "object",
      "required": ["image_file"],
      "additionalProperties": false,
      "properties": {
        "image_file":  { "type": "string", "description": "Path relative to the theme directory." },
        "description": { "type": "string" },
        "shader":      { "type": "string", "description": "Path to a GLSL shader applied to this image." }
      }
    },
    "button_def": {
      "description": "Appearance of the default button style. Themes control appearance only (background image, icon, shaders, sounds) — never layout/position, which is always the page's own flex flow.",
      "type": "object",
      "additionalProperties": false,
      "properties": {
        "description":      { "type": "string" },
        "background_image": { "$ref": "#/$defs/image_with_shader" },
        "icon": {
          "type": "object",
          "required": ["image_file"],
          "additionalProperties": false,
          "properties": {
            "image_file":  { "type": "string" },
            "description": { "type": "string" }
          }
        }
      }
    },

    "menu_def": {
      "description": "One named menu screen. background_image is optional: a screen can have its own background image or fall back to default_background.",
      "type": "object",
      "additionalProperties": false,
      "properties": {
        "background_image": {
          "type": "string",
          "description": "Path to the background image for this menu screen, relative to the theme directory."
        }
      }
    }
  },

  "properties": {
    "name": {
      "type": "string",
      "description": "Human-readable name of the theme shown in the theme picker."
    },

    "description": {
      "type": "string",
      "description": "Short description of the theme."
    },

    "default_menu_button": {
      "description": "Appearance applied to every button in the app.",
      "$ref": "#/$defs/button_def"
    },

    "default_background": {
      "description": "Fallback background used by any screen that does not define its own.",
      "type": "object",
      "required": ["image"],
      "additionalProperties": false,
      "properties": {
        "image":       { "type": "string" },
        "description": { "type": "string" }
      }
    },

    "menus": {
      "description": "Named menu screens.  Keys are menu identifiers (Main, Play, Options, …).",
      "type": "object",
      "additionalProperties": { "$ref": "#/$defs/menu_def" }
    },

    "colors": {
      "description": "Theme colors.",
      "type": "object",
      "additionalProperties": false,
      "properties": {
        "song_editor": {
          "description": "Colors for the song editor.",
          "type": "object",
          "additionalProperties": false,
          "properties": {
            "editor_bg": {
              "description": "Background color for the song editor.",
              "type": "string"
            },
            "hole_box": {
              "description": "Background color for the hole box in the song editor.",
              "type": "string"
            },
            "lane_a": {
              "description": "",
              "type": "string"
            },
            "lane_b": {
              "description": "",
              "type": "string"
            },
            "grid_line": {
              "description": "",
              "type": "string"
            },
            "bar_line": {
              "description": "",
              "type": "string"
            },
            "half_line": {
              "description": "",
              "type": "string"
            },
            "quarter_line": {
              "description": "",
              "type": "string"
            },
            "triplet_line": {
              "description": "",
              "type": "string"
            },
            "accent": {
              "description": "",
              "type": "string"
            },
            "label": {
              "description": "",
              "type": "string"
            },
            "panel_bg": {
              "description": "",
              "type": "string"
            },
            "btn_bg": {
              "description": "",
              "type": "string"
            },
            "btn_active": {
              "description": "",
              "type": "string"
            },
            "field_bg": {
              "description": "",
              "type": "string"
            },
            "field_bg_focus": {
              "description": "",
              "type": "string"
            },
            "ghost_ok": {
              "description": "",
              "type": "string"
            },
            "ghost_bad": {
              "description": "",
              "type": "string"
            }
          }
        },
        "twelve_bar": {
          "description": "Chord-function colors (I/IV/V) for a 12-bar blues progression, shared by the Jam Session bar grid and the song editor's grid background.",
          "type": "object",
          "additionalProperties": false,
          "properties": {
            "tonic": {
              "description": "I (tonic) — the \"home\" chord most bars sit on.",
              "type": "string"
            },
            "subdominant": {
              "description": "IV (subdominant).",
              "type": "string"
            },
            "dominant": {
              "description": "V (dominant).",
              "type": "string"
            }
          }
        },
        "notes": {
          "description": "Blow/draw colors for scored note visuals (the falling-note highway in Play2D/Play3D). Overridden by the colorblind-palette setting when the player has it on.",
          "type": "object",
          "additionalProperties": false,
          "properties": {
            "blow": {
              "description": "",
              "type": "string"
            },
            "draw": {
              "description": "",
              "type": "string"
            }
          }
        },
        "circle_of_fifths": {
          "description": "Colors for dialogs::circle_of_fifths' diagram (used by the circle-of-fifths lesson).",
          "type": "object",
          "additionalProperties": false,
          "properties": {
            "base": {
              "description": "The 11 key points not currently highlighted.",
              "type": "string"
            },
            "harp_key": {
              "description": "The reference harp key's own point.",
              "type": "string"
            },
            "position": {
              "description": "A position's point (one per step clockwise from the harp key).",
              "type": "string"
            }
          }
        }
      }
    }
  }
}
